	0	often as having distinctly human-	like	 features including hair, often (though
	0	never seen a hair style 	like	 that. It was curled something
	0	that. It was curled something 	like	 Farrah Fawcett, but to an
	0	never seen a human looking 	like	 that,' he said. The blonde
	0	expression on her face was 	like	, \'this isn\'t the way
	0	one... and looked at me 	like	, this isn\'t the way
	0	panspermia\'' -- the theory that human-	like	 beings may have migrated to
	0	at the problem of European-	like	 rare Asian types in the
	0	through the lens it looked 	like	 it was going to hit
	0	t believe it - it\'s 	like	 nothing else I\'ve ever
	0	through the lens it looked 	like	 it was going to hit
	0	t believe it - it\'s 	like	 nothing else I\'ve ever
	0	through the lens it looked 	like	 it was going to hit
	0	t believe it - it\'s 	like	 nothing else I\'ve ever
	0	through the lens it looked 	like	 it was going to hit
	0	t believe it - it\'s 	like	 nothing else I\'ve ever
	0	metal and paint... It is 	like	 a mirror reflecting the milky
	0	obvious. The field appears webbed 	like	 a fish net formed into
	0	onto a road that looked 	like	 a highway and saw a
	0	issues and questions we would 	like	 to try to resolve.Further contact
	0	re high up, they look 	like	 uh, they\'re up there
	0	answer that question, he would 	like	 first to speak with his
	0	conversation he said he would 	like	 to put his supervisor, Mr
	0	a giant hammer, but looked 	like	 they\'d hold the rail
	0	We could hear what sounded 	like	 an army of workers immediately
	0	over under a huge tent 	like	 structure buzzing with activity. We
	0	I\'ve never seen anything 	like	 it before.' and 'If anyone
	0	this. I know it looks 	like	 an alien or a Bigfoot
	0	is not lost, and just 	like	 beauty being in the eye
	0	light. He said it looked 	like	 an aircraft light on the
	0	what he saw. It was 	like	 no aircraft he\'d ever
	0	bunch of stuff that looked 	like	 it was maybe 30,000 feet
	0	when she spotted what looked 	like	 a bright star in the
	0	middle of the object seemed 	like	 an extremely bright plasma light
	0	4 thousand feet and looked 	like	 it descended to approx. 2
	0	caused the object to look 	like	 it was changing shapes and
	0	years have never witnessed something 	like	 this before.' source:Thanks to UFO
	0	illuminated from the three flame-	like	, symmetrical appendages on the bottom
	0	object made a pulsating/drumming-	like	 noise which also passed throughout
	0	back are no longer burning 	like	 they were and his lethargic
	0	character. I havenever reported anything 	like	 this before. At 23:30
	0	anunusual milky white color, nothing 	like	 that of the very bright
	0	the lights on the objectlooked 	like	 to him, as he viewed
	0	do not hear many stories 	like	 this,' Vike said. The report
	0	kitchen and saw what looked 	like	 snow or fine pellets of
	0	the white light outside looked 	like	 it flowed like a liquid
	0	outside looked like it flowed 	like	 a liquid wrapping itself around
	0	from time to time, they, 	like	 all police departments, do get
	0	still, and the pond became 	like	 glass as the object sank
	0	sides and the object looked 	like	 metal. Two other children said
	0	drove around and found truck 	like	 tracks that led towards the
	0	be a tornado that sounded 	like	 a muffled lawn mower. I
	0	our solar system an Earth-	like	 planet capable of supporting extraterrestrial
	0	I have never seen anything 	like	 it before in all my
	0	seemed to look a lot 	like	 Hollywood\'s version of a
	0	unconventional aircraft and this was 	like	 nothing we\'ve ever seen.Fourth
	0	contact me, and I would 	like	 some day to meet the
	0	a stealth fighter.'It seemed 	like	 it was some kind of
	0	couple of vans that looked 	like	 support vehicles,' said Hayes. The
	0	next day, it was almost 	like	 they were doing some sort
	0	was then the heavens looked 	like	 the stars were moving around
	0	description, and its appearance was '	like	 it had been dipped in
	0	investigators that the being was 	like	 'a child... a little person
	0	Casebook reader, and I would 	like	 to include his thoughts on
	0	second, or even third polygraph, 	like	 Travis Walton did. If we
	0	The object was somewhat star-	like	 in appearance, however much brighter
	0	The object was somewhat star-	like	 in appearance, however much brighter
	0	The object was somewhat star-	like	 in appearance, however much brighter
	0	The object was somewhat star-	like	 in appearance, however much brighter
	0	The object was somewhat star-	like	 in appearance, however much brighter
	0	strange feeling in my chest, 	like	 when I was standing on
	0	feeling inside my body, maybe 	like	 pulsating electricity, I have no
	0	no idea, I haven't felt 	like	 that before. At first, while
	0	move at all. I was 	like	 in a shock. But while
	0	guess it was pretty big, 	like	 50 meters maybe? The clouds
	0	especially because it doesn't look 	like	 the typical UFO that I
	0	been a glider or something 	like	 that\'A320: \'well maybe a
